query,response
How do I request a refund?,You can request a refund from your Order History page within 7 days of delivery.
How long does it take to process a refund?,Refunds are usually processed within 3–5 business days.
I received a damaged item. What should I do?,Please contact support with a photo of the damaged item for a replacement or refund.
Can I return a product for a refund?,"Yes, you can return eligible items within 7 days of receiving them for a full refund."
What is your refund policy?,"Our refund policy allows returns within 7 days for most items, provided they are unused and in original packaging."
Do I need to pay for return shipping?,Return shipping is free if the item is defective or incorrect.
My refund hasn’t been credited yet.,"If it’s been more than 7 days, please contact support with your order ID for help."
Can I exchange my item instead of refund?,"Yes, exchanges are possible for items of equal value depending on stock availability."
